{
  "$schema": "http://json-schema.org/draft-04/schema",
  "$id": "http://yourdomain.com/schemas/station.json",
  "type": "array",
  "items": {
    "type": "object",
    "properties": {
      "name": { "type": "string" },
      "id":  {
        "type": "integer",
        "minimum": 1
      },
      "line": { "type": "string" },
      "transitions": {
        "type": "object",
        "patternProperties": {
          "^[A-Z]{2}$": {
            "type": "integer",
            "minimum": 1
          }
        },
        "properties": {
          "exit": {
            "type": "integer",
            "minimum": 1
          }
        },
        "additionalProperties": false
      }
    },
    "required": ["name", "id", "line", "transitions"],
    "additionalProperties": false
  }
}